{
  "$schema": "https://json-schema.org/draft/2020-12/schema",
  "$id": "https://github.com/marshallguillory86/maintainability-agent/blob/main/maintainability-agent.schema.json",
  "title": "Maintainability Agent Configuration",
  "type": "object",
  "required": [
    "version"
  ],
  "properties": {
    "analyzers": {
      "type": "object",
      "description": "Which external analysis tools may run. See docs/analyzer-pool.md.",
      "properties": {
        "_doc": {
          "type": "string"
        },
        "depth": {
          "enum": [
            "baseline",
            "moderate",
            "heavy",
            "all"
          ],
          "description": "Cumulative size of the tool pool."
        },
        "license_policy": {
          "enum": [
            "permissive",
            "copyleft-weak",
            "copyleft-any",
            "commercial-free-tier",
            "unverified"
          ],
          "description": "Cumulative license classes admitted."
        },
        "prompt_when_interactive": {
          "type": "boolean",
          "description": "Whether the CLI may ask first-run questions on a terminal. Read by _first_run; config wins over terminal interactivity (decision 7). First-run prompt is release-plan 6.1."
        },
        "allow_tools": {
          "type": "array",
          "items": {
            "type": "string"
          },
          "description": "Catalog slugs admitted despite policy."
        },
        "deny_tools": {
          "type": "array",
          "items": {
            "type": "string"
          },
          "description": "Catalog slugs never run. Deny always wins."
        },
        "deny_license_classes": {
          "type": "array",
          "items": {
            "enum": [
              "permissive",
              "weak-copyleft",
              "strong-copyleft",
              "proprietary",
              "proprietary-free-tier",
              "source-available",
              "unverified"
            ]
          }
        },
        "deny_concerns": {
          "type": "array",
          "items": {
            "type": "string"
          }
        },
        "timeout_seconds": {
          "type": "integer",
          "minimum": 1
        },
        "concerns": {
          "type": "array",
          "description": "What to examine. 'all' selects every concern. Filters the tool pool by what each tool measures.",
          "items": {
            "enum": [
              "all",
              "complexity",
              "duplication",
              "dead-code",
              "documentation",
              "structure",
              "testing",
              "style",
              "types",
              "metrics"
            ]
          }
        },
        "run": {
          "type": "boolean",
          "description": "Whether the external analyzer pool executes. A loaded config file defaults this to true (the pool is the primary evidence source, ADR 006); set false to keep the built-in fallback. CLI flags override per run."
        },
        "class_dirs": {
          "type": "array",
          "items": {
            "type": "string"
          },
          "description": "Extra directories of compiled Java classes for SpotBugs, in addition to target/classes and build/classes. The agent never builds these (ADR 012)."
        },
        "acquire_tools": {
          "type": "boolean",
          "default": false,
          "description": "Declared so this schema describes the key the runtime reads. Setting it in a repository file has no effect: acquisition is a decision the user makes in their own configuration tier, because it fetches and executes a package on their machine (product-intent P1, D35). A repository stating a preference here is ignored, not refused."
        },
        "pipeline_requested": {
          "type": "boolean",
          "description": "Set by first-run setup when the developer answered 'declare': their own pipeline writes SARIF, and the files are asked next (Decision 17)."
        },
        "pipeline_results": {
          "type": "array",
          "description": "SARIF files the developer's own build or pipeline already writes, read and never run (Decision 17). Each turns the concerns it covers from unexamined to examined for the languages its results name; its findings are listed and do not score.",
          "items": {
            "type": "object",
            "additionalProperties": false,
            "required": [
              "path",
              "covers"
            ],
            "properties": {
              "path": {
                "type": "string",
                "minLength": 1,
                "description": "Relative to the repository; a path outside it is refused."
              },
              "covers": {
                "type": "array",
                "minItems": 1,
                "items": {
                  "enum": [
                    "complexity",
                    "duplication",
                    "dead-code",
                    "documentation",
                    "structure",
                    "testing",
                    "style",
                    "types",
                    "metrics"
                  ]
                },
                "description": "The concerns this file covers, chosen by its owner."
              },
              "languages": {
                "type": "array",
                "items": {
                  "type": "string"
                },
                "description": "Languages it covers when its results name no source file, e.g. a clean run: 'C#'."
              }
            }
          }
        }
      },
      "additionalProperties": false
    },
    "economic_context": {
      "description": "Written by first-run setup (ADR 004). `requested` records the opt-in; `loaded_engineering_cost_per_hour` carries the three rates once the staged second ask is answered, and replaces it.",
      "type": "object",
      "properties": {
        "version": {
          "type": "integer"
        },
        "requested": {
          "type": "boolean"
        },
        "loaded_engineering_cost_per_hour": {
          "type": "object",
          "properties": {
            "low": {
              "type": "number"
            },
            "base": {
              "type": "number"
            },
            "high": {
              "type": "number"
            }
          },
          "additionalProperties": false
        }
      },
      "additionalProperties": false
    },
    "expected_commands": {
      "type": "object",
      "additionalProperties": {
        "type": "array",
        "items": {
          "type": "string"
        }
      }
    },
    "expected_files": {
      "type": "array",
      "items": {
        "type": "string"
      }
    },
    "hard_gates": {
      "type": "object",
      "properties": {
        "require_test_command": {
          "type": "boolean"
        },
        "require_readme": {
          "type": "boolean"
        },
        "require_clean_worktree": {
          "type": "boolean"
        },
        "fail_on_file_failures": {
          "type": "boolean"
        },
        "fail_on_function_failures": {
          "type": "boolean"
        },
        "fail_on_duplicate_blocks": {
          "type": "boolean"
        }
      },
      "additionalProperties": false
    },
    "history": {
      "description": "Written by first-run setup: consent to record scan history.",
      "type": "object",
      "properties": {
        "record": {
          "type": "boolean"
        }
      },
      "additionalProperties": false
    },
    "idiom_groups": {
      "type": "object",
      "description": "Concern name -> list of competing package names. Overrides the shipped list.",
      "additionalProperties": {
        "type": "array",
        "items": {
          "type": "string"
        }
      }
    },
    "instruction_pack": {
      "type": "object",
      "properties": {
        "project_name": {
          "type": "string"
        },
        "strictness": {
          "type": "string"
        },
        "test_policy": {
          "type": "string"
        },
        "architecture_notes": {
          "type": "array",
          "items": {
            "type": "string"
          }
        }
      },
      "additionalProperties": false
    },
    "paths": {
      "type": "object",
      "properties": {
        "include_extensions": {
          "type": "array",
          "items": {
            "type": "string"
          }
        },
        "exclude_patterns": {
          "type": "array",
          "items": {
            "type": "string"
          }
        },
        "exclude_additional": {
          "type": "array",
          "items": {
            "type": "string"
          },
          "description": "Exclusions added to the defaults and to any earlier tier's, rather than replacing them as exclude_patterns does."
        }
      },
      "additionalProperties": false
    },
    "policy": {
      "description": "Repository policy (Decision 15). `changed_code` holds the functions a change touches to stricter limits than the standard; it may only tighten, and it decides the gate, never the grade. Applies on a run given --changed-only.",
      "type": "object",
      "properties": {
        "changed_code": {
          "type": "object",
          "properties": {
            "max_function_lines": {
              "type": "integer",
              "minimum": 1
            },
            "max_complexity": {
              "type": "integer",
              "minimum": 1
            },
            "max_cognitive_complexity": {
              "type": "integer",
              "minimum": 1
            }
          },
          "additionalProperties": false
        }
      },
      "additionalProperties": false
    },
    "presentation": {
      "description": "Written by first-run setup: the report skin this user chose.",
      "type": "object",
      "properties": {
        "format": {
          "type": "string",
          "enum": [
            "chat",
            "markdown",
            "html"
          ]
        }
      },
      "additionalProperties": false
    },
    "risk_patterns": {
      "type": "array",
      "items": {
        "type": "object",
        "required": [
          "name",
          "pattern"
        ],
        "properties": {
          "name": {
            "type": "string"
          },
          "pattern": {
            "type": "string"
          },
          "extensions": {
            "type": "array",
            "items": {
              "type": "string"
            }
          }
        },
        "additionalProperties": false
      }
    },
    "security": {
      "description": "The delegated security pillar. `timeout_seconds` is how long secure-code-agent may run before the pillar is reported unmeasured; held to 1..3600, default 900.",
      "type": "object",
      "properties": {
        "timeout_seconds": {
          "type": "integer",
          "minimum": 1,
          "maximum": 3600
        }
      },
      "additionalProperties": false
    },
    "test_execution": {
      "description": "Written by first-run setup: the opt-in to run this repository's own suite. The command itself is a staged second ask and lands in `expected_commands.test` — the tree may say how it is tested, only the person may choose what the host executes.",
      "type": "object",
      "properties": {
        "requested": {
          "type": "boolean"
        }
      },
      "additionalProperties": false
    },
    "thresholds": {
      "type": "object",
      "properties": {
        "max_file_lines": {
          "type": "integer",
          "minimum": 1
        },
        "warn_file_lines": {
          "type": "integer",
          "minimum": 1
        },
        "max_function_lines": {
          "type": "integer",
          "minimum": 1
        },
        "warn_function_lines": {
          "type": "integer",
          "minimum": 1
        },
        "max_class_lines": {
          "type": "integer",
          "minimum": 1
        },
        "warn_class_lines": {
          "type": "integer",
          "minimum": 1
        },
        "max_complexity": {
          "type": "integer",
          "minimum": 1
        },
        "warn_complexity": {
          "type": "integer",
          "minimum": 1
        },
        "max_cognitive_complexity": {
          "type": "integer",
          "minimum": 1
        },
        "warn_cognitive_complexity": {
          "type": "integer",
          "minimum": 1
        },
        "max_duplicate_blocks": {
          "type": "integer",
          "minimum": 0
        },
        "duplicate_block_lines": {
          "type": "integer",
          "minimum": 2
        }
      },
      "additionalProperties": false
    },
    "version": {
      "type": "integer",
      "const": 1
    }
  },
  "additionalProperties": false
}
